{
  "$schema": "https://rhiza.dev/architecture-gates/milestone-evidence/1.0.0",
  "schema_version": "1.0.0",
  "milestone": "M05",
  "architecture_version": "V4.2",
  "commit": "2bb698daa5b91d6769447c35152e3c68f85de714",
  "fixtures": [
    {
      "id": "g0-fixture-registry-v1",
      "path": "docs/architecture-gates/fixture-registry.json",
      "role": "fixture_registry"
    },
    {
      "id": "g0-characterization-map-v1",
      "path": "docs/architecture-gates/G0/characterization-map.json",
      "role": "characterization_map"
    },
    {
      "id": "g0-blocking-evidence-v1",
      "path": "docs/architecture-gates/G0/evidence.json",
      "role": "acceptance_fixture"
    },
    {
      "id": "m02-empty-boundary-exception-registry-v1",
      "path": "scripts/boundary-gates/boundary-exceptions.json",
      "role": "acceptance_fixture"
    },
    {
      "id": "m04-legacy-resource-v1",
      "path": "docs/architecture-gates/M04/resource-fixture.json",
      "role": "acceptance_fixture"
    },
    {
      "id": "m05-transaction-journal-v1",
      "path": "docs/architecture-gates/M05/journal-fixture.json",
      "role": "acceptance_fixture"
    }
  ],
  "commands": [
    {
      "command": "pnpm run lint",
      "result": "pass"
    },
    {
      "command": "pnpm run typecheck",
      "result": "pass"
    },
    {
      "command": "pnpm run test:unit",
      "result": "pass"
    },
    {
      "command": "pnpm run test:e2e",
      "result": "pass"
    },
    {
      "command": "pnpm run licenses:verify",
      "result": "pass"
    },
    {
      "command": "pnpm run verify:g0",
      "result": "pass"
    },
    {
      "command": "pnpm run verify:m02:boundaries",
      "result": "pass"
    },
    {
      "command": "pnpm vitest run e2e/m05-journal.e2e.test.ts e2e/postgres-schema.e2e.test.ts e2e/postgres-store.e2e.test.ts server/application/create-application.test.ts server/embedded-store.test.ts src/App.test.tsx scripts/migrate.test.ts --maxWorkers=1 --testTimeout=30000",
      "result": "pass"
    },
    {
      "command": "pnpm run build",
      "result": "pass"
    }
  ],
  "checksums": {
    ".github/workflows/ci.yml": {
      "algorithm": "sha256",
      "current": "99c09313220047945996770cb21f2f35eb47c09170dee2612d7d8112cfe54b6b",
      "recorded_commit": "99c09313220047945996770cb21f2f35eb47c09170dee2612d7d8112cfe54b6b"
    },
    ".gitignore": {
      "algorithm": "sha256",
      "current": "7bdbf4ab91600cd679cee2077d389934aad1e633ffa7d70cd0b7cde501e74db7",
      "recorded_commit": "7bdbf4ab91600cd679cee2077d389934aad1e633ffa7d70cd0b7cde501e74db7"
    },
    "eslint.config.js": {
      "algorithm": "sha256",
      "current": "60df5e0941a56d11542076792a3f36c729d3cf3f30a70fb490bc48184b65ee24",
      "recorded_commit": "60df5e0941a56d11542076792a3f36c729d3cf3f30a70fb490bc48184b65ee24"
    },
    "package.json": {
      "algorithm": "sha256",
      "current": "c3f2f9b08151b2a544fb603498f1efdc424895deb8aceb08bfb4bd9180e6e945",
      "recorded_commit": "c3f2f9b08151b2a544fb603498f1efdc424895deb8aceb08bfb4bd9180e6e945"
    },
    "docs/architecture-gates/README.md": {
      "algorithm": "sha256",
      "current": "8fa3246aa10a6289c40febdc5abd2c67a9c075fe5d6faabf66bf05b7c5dd2c1a",
      "recorded_commit": "8fa3246aa10a6289c40febdc5abd2c67a9c075fe5d6faabf66bf05b7c5dd2c1a"
    },
    "docs/architecture-gates/fixture-registry.json": {
      "algorithm": "sha256",
      "current": "7f220bcbc564af7e09dd51906548cde05b3e6b504d031bce4518108f081696be",
      "recorded_commit": "7f220bcbc564af7e09dd51906548cde05b3e6b504d031bce4518108f081696be"
    },
    "docs/architecture-gates/G0/characterization-map.json": {
      "algorithm": "sha256",
      "current": "0f77dd5b31b26dacff9525c672ff5197e63fe173e5653367e4a4126c700fd933",
      "recorded_commit": "0f77dd5b31b26dacff9525c672ff5197e63fe173e5653367e4a4126c700fd933"
    },
    "docs/architecture-gates/G0/evidence.json": {
      "algorithm": "sha256",
      "current": "424b03b16198cf576dbdcf93112134d005277bb098cdd871ccbe182c36c9e869",
      "recorded_commit": "424b03b16198cf576dbdcf93112134d005277bb098cdd871ccbe182c36c9e869"
    },
    "scripts/architecture-gates/verify-g0.ts": {
      "algorithm": "sha256",
      "current": "2cf94049dd8397535371e16b7c246f50f80b6cc8faaff68024060d2d3934e07a",
      "recorded_commit": "2cf94049dd8397535371e16b7c246f50f80b6cc8faaff68024060d2d3934e07a"
    },
    "scripts/architecture-gates/verify-m02-boundaries.test.ts": {
      "algorithm": "sha256",
      "current": "b790f26bf4f11dd624842345236e44b03d234cbba83078ae1a024c13d6018a89",
      "recorded_commit": "b790f26bf4f11dd624842345236e44b03d234cbba83078ae1a024c13d6018a89"
    },
    "scripts/architecture-gates/verify-m02-boundaries.ts": {
      "algorithm": "sha256",
      "current": "b10a6cf5da97873a701e81fae52bd9c05c7559ef87a49f55aa93281f2f4ae0fb",
      "recorded_commit": "b10a6cf5da97873a701e81fae52bd9c05c7559ef87a49f55aa93281f2f4ae0fb"
    },
    "scripts/architecture-gates/verify-milestone-evidence.test.ts": {
      "algorithm": "sha256",
      "current": "ef3819ade76b44d6876523b19ee404ded4030b893eab27dd4615186bddac7958",
      "recorded_commit": "ef3819ade76b44d6876523b19ee404ded4030b893eab27dd4615186bddac7958"
    },
    "scripts/architecture-gates/verify-milestone-evidence.ts": {
      "algorithm": "sha256",
      "current": "2846b003cebf6176f4e109a03987f93a37f1ce542edf7418c6fbdace9f3b0a35",
      "recorded_commit": "2846b003cebf6176f4e109a03987f93a37f1ce542edf7418c6fbdace9f3b0a35"
    },
    "scripts/boundary-gates/boundary-exceptions.json": {
      "algorithm": "sha256",
      "current": "1471a956c5cad0ecdf4b1390e76af9dc826eb3d5525bc0843d3d1b2054fc1ba3",
      "recorded_commit": "1471a956c5cad0ecdf4b1390e76af9dc826eb3d5525bc0843d3d1b2054fc1ba3"
    },
    "scripts/boundary-gates/boundary-lint.test.ts": {
      "algorithm": "sha256",
      "current": "21339d00f1a42d37185e8b80da10512680f8a3d25f68388b2c4c5b4003c8eda2",
      "recorded_commit": "21339d00f1a42d37185e8b80da10512680f8a3d25f68388b2c4c5b4003c8eda2"
    },
    "server/app.ts": {
      "algorithm": "sha256",
      "current": "f313212bc5ada06df3591d49604e8deb3def30d77360bb4a829a232f75035412",
      "recorded_commit": "f313212bc5ada06df3591d49604e8deb3def30d77360bb4a829a232f75035412"
    },
    "server/app.test.ts": {
      "algorithm": "sha256",
      "current": "5318e22a97ffe580ddab7f844a3d3a890b96c4ea12b14e1eb3fcbe0f7440f2c7",
      "recorded_commit": "5318e22a97ffe580ddab7f844a3d3a890b96c4ea12b14e1eb3fcbe0f7440f2c7"
    },
    "server/ai-provider.test.ts": {
      "algorithm": "sha256",
      "current": "dfde1c1843d818e5028236a0a74cd5d3b35fb8bd3ab3a6384ac0f117d1ec3bae",
      "recorded_commit": "dfde1c1843d818e5028236a0a74cd5d3b35fb8bd3ab3a6384ac0f117d1ec3bae"
    },
    "server/ai-provider.ts": {
      "algorithm": "sha256",
      "current": "47175d3a02cdd2b03041a439dc69de591465ceee00e7fa4d2380521b4a77b267",
      "recorded_commit": "47175d3a02cdd2b03041a439dc69de591465ceee00e7fa4d2380521b4a77b267"
    },
    "server/application/create-application.test.ts": {
      "algorithm": "sha256",
      "current": "ea27dcdf1fba79af36adcfb95c0c91ce3b8baa6c511926e595f35f0545f23bca",
      "recorded_commit": "ea27dcdf1fba79af36adcfb95c0c91ce3b8baa6c511926e595f35f0545f23bca"
    },
    "server/application/create-application.ts": {
      "algorithm": "sha256",
      "current": "3faff682aa6abb94b1625de7d2a6e25476c633e64fbfbf84dedb5fecc4bc68e9",
      "recorded_commit": "3faff682aa6abb94b1625de7d2a6e25476c633e64fbfbf84dedb5fecc4bc68e9"
    },
    "server/application/ports/legacy-upload.ts": {
      "algorithm": "sha256",
      "current": "d3998e7a9e0eed0e055d816fa88a8848ed03d5b4c5f27fd0388c81394a5bda46",
      "recorded_commit": "d3998e7a9e0eed0e055d816fa88a8848ed03d5b4c5f27fd0388c81394a5bda46"
    },
    "server/application/ports/provider-management.ts": {
      "algorithm": "sha256",
      "current": "b4f497e3366ad349dcc1dc34cb390466eedae2f820742f5b43457d40f4127cd2",
      "recorded_commit": "b4f497e3366ad349dcc1dc34cb390466eedae2f820742f5b43457d40f4127cd2"
    },
    "server/application/ports/runtime.ts": {
      "algorithm": "sha256",
      "current": "585f3e02444a551addf9e994fa348090e33e6d92343f61a14f5db94da67b83c7",
      "recorded_commit": "585f3e02444a551addf9e994fa348090e33e6d92343f61a14f5db94da67b83c7"
    },
    "server/application/ports/workspace-unit-of-work.ts": {
      "algorithm": "sha256",
      "current": "1dd25787721c9e1868e38ea4e75072b60e424733e54b252ed2d3a51e310928fb",
      "recorded_commit": "1dd25787721c9e1868e38ea4e75072b60e424733e54b252ed2d3a51e310928fb"
    },
    "server/context-runtime/legacy-planner.ts": {
      "algorithm": "sha256",
      "current": "ba5adfa09f2431dd7b9b36a6cb54131188df679b3175b6e14138a10db44ddde1",
      "recorded_commit": "ba5adfa09f2431dd7b9b36a6cb54131188df679b3175b6e14138a10db44ddde1"
    },
    "server/context-runtime/port.ts": {
      "algorithm": "sha256",
      "current": "cb93df0823262e328d2d2afa932745d651c7c45a7083fcffbbd5f273a3667558",
      "recorded_commit": "cb93df0823262e328d2d2afa932745d651c7c45a7083fcffbbd5f273a3667558"
    },
    "server/contracts/application-error.test.ts": {
      "algorithm": "sha256",
      "current": "341e046c3ca36b8f83c3b249111f7e63e008771c730372010e55db1a2d4a5a76",
      "recorded_commit": "341e046c3ca36b8f83c3b249111f7e63e008771c730372010e55db1a2d4a5a76"
    },
    "server/contracts/application-error.ts": {
      "algorithm": "sha256",
      "current": "4eaa337f878fb03e5a9522146877f9310ae492fc519ed470a61e0da6c0ba4c91",
      "recorded_commit": "4eaa337f878fb03e5a9522146877f9310ae492fc519ed470a61e0da6c0ba4c91"
    },
    "server/contracts/application.ts": {
      "algorithm": "sha256",
      "current": "4dc58ba0a043c775774fb042b2e33e84eab14e34ad6124e758d63f9904a2898d",
      "recorded_commit": "4dc58ba0a043c775774fb042b2e33e84eab14e34ad6124e758d63f9904a2898d"
    },
    "server/contracts/references.ts": {
      "algorithm": "sha256",